{
  "$schema": "https://json-schema.org/draft/2020-12/schema",
  "$id": "https://schemas.example.local/rci/analysis-result.schema.json",
  "title": "Retail Competitive Intelligence Analysis Result",
  "type": "object",
  "additionalProperties": false,
  "required": [
    "schema_version",
    "analysis_id",
    "collection_run_id",
    "generated_at",
    "benchmark_retailer",
    "product_pack",
    "source_summary",
    "coverage",
    "comparisons",
    "data_quality",
    "validation"
  ],
  "properties": {
    "schema_version": {
      "type": "string"
    },
    "analysis_id": {
      "type": "string"
    },
    "collection_run_id": {
      "type": "string"
    },
    "generated_at": {
      "type": "string"
    },
    "benchmark_retailer": {
      "type": "string"
    },
    "competitors": {
      "type": "array",
      "items": {
        "type": "string"
      }
    },
    "product_pack": {
      "type": "object",
      "additionalProperties": false,
      "required": [
        "id",
        "version"
      ],
      "properties": {
        "id": {
          "type": "string"
        },
        "version": {
          "type": "string"
        }
      }
    },
    "source_summary": {
      "type": "object",
      "additionalProperties": true
    },
    "coverage": {
      "type": "array",
      "items": {
        "type": "object",
        "additionalProperties": true
      }
    },
    "segments": {
      "type": "array",
      "items": {
        "type": "object",
        "additionalProperties": true
      }
    },
    "comparisons": {
      "type": "array",
      "items": {
        "type": "object",
        "additionalProperties": true
      }
    },
    "data_quality": {
      "type": "object",
      "additionalProperties": true
    },
    "validation": {
      "type": "object",
      "additionalProperties": true
    },
    "findings": {
      "type": "array",
      "items": {
        "type": "object",
        "additionalProperties": true
      }
    },
    "recommendations": {
      "type": "array",
      "items": {
        "type": "object",
        "additionalProperties": true
      }
    },
    "artifacts": {
      "type": "array",
      "items": {
        "type": "object",
        "additionalProperties": true
      }
    },
    "provenance": {
      "type": "object",
      "additionalProperties": true
    }
  }
}
